password,name,description,address,phone,email
gravida,Nullam Enim Incorporated,quam a felis ullamcorper viverra. Maecenas iaculis,1953 Neque. Road,1-927-315-3516,tellus.aenean@aol.net
Morbi,Montes Nascetur Corporation,"et, magna. Praesent interdum ligula eu enim. Etiam imperdiet",Ap #610-3173 Nam St.,1-462-733-2248,nullam.ut@protonmail.com
quam.,Est Mauris LLP,"id, blandit at,",342-9264 Primis Road,1-464-742-5746,sed.turpis@icloud.org
ut,Ridiculus Mus Corporation,"a purus. Duis elementum, dui quis accumsan convallis,",195-6134 In Av.,(920) 946-3219,sem@yahoo.ca
fermentum,Mollis Inc.,"parturient montes, nascetur",Ap #389-2800 Donec St.,1-336-308-6647,dapibus@outlook.ca
ipsum.,Turpis Aliquam Adipiscing Ltd,non,710-8254 Sed Av.,(728) 181-3085,convallis.dolor@icloud.com
magna.,Elementum Inc.,eget metus eu erat semper rutrum. Fusce dolor,"P.O. Box 982, 7674 Fringilla Rd.",(807) 352-4162,suscipit.nonummy@outlook.edu
Pellentesque,Dis LLP,accumsan neque et nunc. Quisque,6932 Egestas Avenue,1-882-394-1184,dapibus@hotmail.org
dapibus,Convallis Dolor Inc.,"tempor lorem, eget mollis lectus pede et risus. Quisque","P.O. Box 679, 3304 Hendrerit Street",(351) 384-2885,mauris.suspendisse@protonmail.net
libero,Adipiscing Ligula Institute,"egestas a,",Ap #220-6198 Nunc Avenue,(883) 214-7224,accumsan@outlook.couk
lacinia.,Nulla Aliquet Corp.,"magnis dis parturient montes,",Ap #750-7964 Ipsum. Street,(337) 355-1548,turpis@outlook.ca
ligula.,Ut Nisi A Corporation,"dictum placerat, augue. Sed molestie. Sed id risus","P.O. Box 484, 8592 Inceptos St.",1-321-533-4945,elit.fermentum.risus@aol.ca
tristique,Libero Morbi Ltd,amet ultricies sem magna nec quam. Curabitur,"P.O. Box 729, 593 Convallis St.",1-540-211-5952,sagittis@icloud.edu
"et,",Ipsum Suspendisse Sagittis Institute,tellus. Aenean egestas hendrerit neque. In ornare sagittis felis.,932-5073 Sit Avenue,(729) 681-8122,malesuada.vel@hotmail.net
fermentum,Ut Nec Institute,Curae Donec,512-1840 Proin St.,1-643-877-1672,lorem@protonmail.couk
adipiscing,Dignissim Pharetra Nam Inc.,Proin dolor. Nulla semper tellus,825-4803 Erat St.,1-336-542-2163,vel.venenatis@hotmail.com
"sapien,",Id Risus Quis LLC,"ac, eleifend vitae, erat. Vivamus",279-6655 Aenean Road,1-627-565-5455,posuere@icloud.couk
vel,Imperdiet Dictum LLP,magna. Duis dignissim tempor arcu.,830-637 Varius Avenue,1-843-349-5730,vel@protonmail.ca
Nulla,Nunc Foundation,nonummy. Fusce fermentum fermentum arcu.,"379-748 Amet, Street",(148) 488-4556,nibh.lacinia@outlook.org
nonummy.,Purus Incorporated,"vitae, orci. Phasellus dapibus quam",Ap #613-8955 Eleifend Rd.,1-746-713-4327,laoreet.libero@aol.net
lacus.,Molestie Sed Corporation,ipsum primis in faucibus,2433 Dolor Ave,(287) 151-1650,mollis.lectus@google.org
est,Sodales Mauris Foundation,"ac,",Ap #728-2020 Sit Rd.,(266) 192-1143,mauris.quis.turpis@outlook.ca
tellus.,Velit Justo Associates,interdum. Nunc sollicitudin commodo ipsum.,3539 Vitae St.,(842) 391-7972,velit@protonmail.org
tempus,Molestie Pharetra Consulting,"eget metus eu erat semper rutrum. Fusce dolor quam, elementum","P.O. Box 857, 3388 Eu St.",1-601-605-3175,sapien.aenean@aol.ca
dolor,Nunc Nulla Vulputate Institute,Quisque ac libero nec ligula consectetuer rhoncus.,179-2521 Vestibulum Av.,1-999-783-9365,egestas.urna@aol.com
tellus,Aliquam Ornare Libero Associates,ullamcorper magna. Sed eu eros. Nam consequat dolor,"P.O. Box 961, 9521 Integer St.",(223) 747-3518,nibh.phasellus.nulla@outlook.couk
hendrerit,Eleifend Inc.,eu eros. Nam,Ap #106-9981 Dictum St.,(853) 622-2126,ac.ipsum@aol.org
primis,Eget Mollis Company,Maecenas ornare egestas ligula. Nullam feugiat placerat,935-8414 Habitant Rd.,1-661-438-3661,non.lobortis@yahoo.org
orci,Dictum Placerat Augue PC,mi lacinia mattis. Integer eu lacus. Quisque,Ap #992-2741 Imperdiet St.,(651) 538-3218,cras.convallis.convallis@yahoo.com
dictum.,Lobortis PC,orci luctus et ultrices posuere cubilia,360-8915 In Road,(562) 547-5170,tortor.nibh@google.com
Aliquam,Integer LLP,aliquet.,6235 Congue. Rd.,1-313-674-3846,sed@yahoo.ca
Phasellus,Tincidunt Vehicula Risus Limited,"vulputate eu, odio. Phasellus at augue id",Ap #165-6669 Accumsan Ave,(725) 692-4146,orci.ut@aol.edu
felis.,Quisque Imperdiet Institute,"et risus. Quisque libero lacus, varius et,",516-7800 Mi. Ave,(589) 267-4345,nec.tellus.nunc@hotmail.org
mi.,Massa Mauris Vestibulum Foundation,magna. Sed eu eros. Nam consequat dolor vitae dolor. Donec,3267 Dolor Road,1-341-449-8883,iaculis.aliquet@outlook.couk
dictum,Sed Foundation,nisi. Cum sociis,Ap #346-9372 Nulla Av.,(818) 427-5007,aliquam.iaculis@icloud.edu
fermentum,Nec Malesuada LLC,"In lorem. Donec elementum, lorem ut aliquam iaculis, lacus",331-3157 Primis Street,(493) 881-1667,eu.nulla@aol.edu
Quisque,Quis Pede Praesent LLP,eu augue porttitor interdum. Sed,820-8965 Aliquam Rd.,(625) 584-1797,et.commodo@google.ca
Mauris,Cursus Ltd,Sed neque. Sed,930-5763 Nisi St.,1-341-281-1326,enim@protonmail.org
"placerat,",Vivamus Euismod Urna Foundation,hendrerit neque. In ornare,877-591 Diam Rd.,(668) 695-5086,facilisis.suspendisse@protonmail.net
lorem,Pede Et Risus PC,"consequat auctor, nunc nulla vulputate dui, nec tempus mauris erat",Ap #688-1384 Mauris Street,1-872-782-0678,amet.consectetuer@yahoo.couk
"ac,",Facilisi LLP,urna.,"P.O. Box 174, 4155 Sapien, St.",(303) 355-1514,amet.metus@google.edu
nec,Gravida Sagittis Duis PC,vel sapien imperdiet ornare. In faucibus. Morbi vehicula.,576-9323 Bibendum Street,1-102-769-3375,fusce.aliquam.enim@yahoo.net
tincidunt,Augue Consulting,massa lobortis ultrices. Vivamus rhoncus. Donec,672-8406 Mauris St.,1-207-715-1140,nibh.donec@hotmail.couk
In,Nunc Ullamcorper Velit LLC,"aliquet odio. Etiam ligula tortor, dictum eu, placerat eget,","P.O. Box 116, 668 Fermentum Avenue",(694) 316-3715,eget.volutpat@aol.ca
aliquet,Nam Incorporated,"dolor sit amet, consectetuer adipiscing","P.O. Box 727, 975 Amet, Av.",1-916-945-3471,dapibus.quam.quis@aol.ca
"imperdiet,",Orci Lacus Industries,"risus. Donec nibh enim, gravida sit amet, dapibus id,",479-5872 Est. St.,1-871-771-1616,lectus.cum.sociis@google.net
ipsum.,Euismod Mauris Eu Inc.,et netus et malesuada,"3480 Amet, St.",(226) 712-3668,libero.integer@aol.edu
"placerat,",Mauris Sagittis Incorporated,"orci quis lectus. Nullam suscipit, est ac facilisis",198-2724 Consequat Avenue,1-514-194-8988,cras.eu.tellus@icloud.edu
lectus,Pharetra Nibh Aliquam Institute,Proin,"Ap #691-9227 Lorem, St.",(656) 663-3683,donec.nibh@outlook.org
ac,Cras Dictum PC,"mollis nec, cursus a, enim. Suspendisse aliquet,",Ap #686-270 Eu Rd.,(547) 861-1215,non@icloud.ca
"a,",Eu Turpis Inc.,a feugiat tellus lorem eu metus. In lorem. Donec,757-9621 Per Street,(123) 817-7383,aliquam.arcu@aol.com
pretium,Sed Dui Associates,vel nisl. Quisque,Ap #833-1300 Mi Avenue,(523) 664-0818,cras.convallis.convallis@aol.com
et,Tellus Imperdiet Foundation,risus. Morbi,3681 Cras Ave,1-131-660-5199,congue.elit.sed@google.ca
"in,",Vitae Posuere At Institute,"egestas, urna",Ap #326-1576 Molestie. St.,(511) 473-7364,vivamus@outlook.ca
"nunc,",Consequat Purus Incorporated,lobortis risus.,6581 Turpis Road,1-918-877-8875,sit@hotmail.org
Ut,Proin Sed Incorporated,vehicula. Pellentesque tincidunt tempus,3167 In Street,(416) 777-3765,interdum.feugiat@google.com
"rutrum,",Vel Sapien Imperdiet LLC,adipiscing. Mauris molestie,Ap #452-8037 Vitae Road,1-964-683-3278,molestie@outlook.com
ligula.,Enim Consulting,Morbi metus. Vivamus,Ap #807-3475 Sed Ave,1-724-514-6727,faucibus.lectus@icloud.com
et,Ante Blandit Corp.,"mi lorem, vehicula et, rutrum eu, ultrices sit",Ap #285-2853 Ad Rd.,1-849-983-9636,sit.amet.massa@yahoo.couk
"vulputate,",Sem Pellentesque Corporation,"eu metus. In lorem. Donec elementum,",867-2955 Lacinia. Rd.,(337) 177-8782,ac.mi@aol.org
nascetur,Aliquam Vulputate Ullamcorper Corp.,"commodo at,",145-8921 Integer Ave,1-225-675-2982,viverra.donec.tempus@google.org
eget,Mauris Blandit PC,"egestas a, dui. Cras pellentesque. Sed","P.O. Box 839, 6800 Accumsan Ave",(355) 399-9186,vehicula.pellentesque.tincidunt@yahoo.edu
id,A Nunc Inc.,mollis lectus pede et risus.,Ap #990-5235 Dolor. Ave,1-777-772-5435,pellentesque.massa.lobortis@aol.com
vestibulum,Ac Nulla Consulting,"iaculis quis, pede.",192-1469 Dictum Ave,(503) 913-3843,sem.molestie@protonmail.couk
lobortis,Non Lobortis LLC,arcu. Sed eu nibh vulputate mauris sagittis,103-1153 Hendrerit St.,(868) 743-3341,luctus.aliquet@protonmail.org
pede,Lorem Luctus Ut PC,"tempor bibendum. Donec felis orci, adipiscing non, luctus",Ap #942-2297 Tempus St.,1-983-574-0941,parturient.montes@yahoo.com
rutrum.,Sed Orci Lobortis Industries,"rhoncus. Donec est. Nunc ullamcorper, velit in",Ap #450-7235 Accumsan Ave,(453) 255-2513,cursus.nunc@hotmail.couk
erat,At Iaculis Company,vitae diam. Proin dolor. Nulla semper tellus,Ap #170-8538 Arcu St.,1-758-418-6638,nunc@aol.com
ac,Velit Eu Industries,gravida. Praesent eu nulla at sem molestie sodales.,"6853 Mi, Avenue",(886) 741-4169,fringilla.ornare@outlook.edu
eu,Tempus Lorem LLP,"enim, sit amet ornare",Ap #820-1838 Luctus Road,(501) 628-8271,sit.amet.metus@yahoo.edu
et,Lectus Ante Inc.,sit amet orci. Ut sagittis lobortis mauris. Suspendisse aliquet,Ap #752-5491 Lacus. Rd.,1-787-261-0308,ante.blandit@icloud.ca
malesuada,Nunc Ltd,"ultricies ligula. Nullam enim. Sed nulla ante, iaculis nec,",2817 Est Road,1-555-385-3629,nunc.risus.varius@protonmail.org
"fringilla,",Est LLP,"sapien, gravida non, sollicitudin a, malesuada id, erat. Etiam",230 Nascetur Rd.,(324) 212-1661,cubilia@icloud.couk
Vivamus,Etiam LLC,magna. Nam,504-3033 Ipsum. St.,1-512-874-8685,duis.risus.odio@icloud.org
tellus.,Sed Congue Institute,"mauris sapien, cursus in, hendrerit consectetuer, cursus et, magna.",822-2711 Orci St.,(485) 760-7306,adipiscing.elit@aol.ca
arcu,Placerat Velit Company,Quisque nonummy ipsum non arcu. Vivamus sit amet risus.,913-2031 Non Avenue,1-925-812-4847,phasellus.elit@outlook.edu
nisl.,Sed Pharetra Institute,dolor,834-5070 Cras Ave,1-147-422-1280,sapien.nunc@aol.couk
"ornare,",Posuere Cubilia Inc.,id enim. Curabitur massa. Vestibulum,Ap #662-6559 Metus St.,1-815-584-4631,proin.non.massa@protonmail.org
Phasellus,Nulla Ltd,metus. Aenean sed pede nec ante blandit,Ap #998-5838 Praesent Rd.,1-813-778-8292,nam.tempor@google.org
"vulputate,",Dignissim Lacus Aliquam Foundation,congue,"266-4956 Ornare, Street",(672) 667-1476,nonummy@icloud.ca
blandit,Eget Lacus Mauris Corporation,"lorem, vehicula et, rutrum",521-6608 Auctor Street,1-388-945-5136,pede.ac@outlook.edu
lectus.,Eu Corporation,Nunc ut erat. Sed,389-8051 Pede Street,(714) 537-1824,proin.sed.turpis@protonmail.org
In,Sodales Company,pede.,632-8166 Tincidunt. Av.,1-789-722-1171,sem.mollis.dui@protonmail.edu
"a,",Amet Orci Industries,Aenean eget magna. Suspendisse tristique,332-8045 Malesuada Street,(484) 175-6214,molestie.orci@google.org
sem,Ornare Elit Corporation,turpis. In condimentum. Donec at arcu.,"P.O. Box 445, 4440 Sit St.",(147) 697-2488,pede.nonummy@icloud.edu
Fusce,Eu Limited,odio,423-8446 In Street,1-775-110-1315,placerat@protonmail.net
neque.,Orci Corp.,"nec, leo. Morbi neque tellus, imperdiet non,","Ap #741-4863 Purus, Street",(815) 688-1065,maecenas.iaculis@aol.com
Aenean,Blandit Mattis Cras LLP,vitae aliquam eros turpis non,5305 Donec Av.,(392) 705-9477,ipsum@protonmail.org
a,Mauris Vel LLC,blandit congue. In scelerisque scelerisque dui.,Ap #148-9688 Nunc Street,(773) 124-2246,in.at.pede@protonmail.net
Nam,Sem Vitae Ltd,"id, erat.","3891 Cursus, St.",(916) 341-4961,rutrum@icloud.edu
"id,",Nulla Eget Industries,Aliquam gravida mauris ut mi.,Ap #106-1686 Lectus Ave,(215) 468-1434,lacus.vestibulum.lorem@hotmail.net
habitant,Ac Mattis Corp.,"eleifend vitae,",226 Odio. Av.,1-595-470-8238,praesent.interdum.ligula@hotmail.ca
libero,Euismod Urna Nullam Limited,dignissim magna a tortor. Nunc,"P.O. Box 816, 6319 Vivamus Rd.",(532) 232-2846,orci.luctus@hotmail.net
tempus,Eu Placerat Eget Industries,dignissim,Ap #510-4331 Malesuada. St.,(133) 826-7898,diam.dictum@outlook.couk
Mauris,Feugiat Incorporated,a neque. Nullam ut nisi a,172-8730 Non Street,(544) 848-5884,nam.interdum.enim@google.couk
egestas.,Integer Tincidunt Incorporated,Fusce feugiat.,Ap #882-5342 Phasellus Rd.,1-435-743-7978,praesent.luctus.curabitur@protonmail.couk
auctor,Suspendisse Tristique Neque Inc.,"eu, ligula. Aenean",Ap #384-640 Netus Ave,1-518-378-7318,ut@protonmail.couk
Donec,Donec Non Justo Inc.,pellentesque. Sed dictum. Proin eget odio. Aliquam vulputate ullamcorper,533-6675 Sit Rd.,(456) 329-2072,malesuada.integer@yahoo.net
"non,",Aliquet Proin Velit Incorporated,rutrum lorem ac,3345 Phasellus Avenue,(325) 965-6138,nunc@hotmail.edu
"pharetra,",Aenean Ltd,"Etiam laoreet, libero","259-1199 Elit, Avenue",(438) 613-6043,nunc.risus@outlook.ca
"mauris,",Lacus Foundation,"purus, accumsan interdum libero dui",Ap #322-9745 Non Road,1-763-631-2968,nullam.enim@yahoo.ca
fermentum,Nibh Sit LLP,bibendum fermentum metus. Aenean,"P.O. Box 857, 3012 Sociis Av.",(583) 435-7445,diam.pellentesque@protonmail.org
rhoncus.,Mauris Corporation,"non, bibendum sed, est. Nunc",1717 Ut Road,1-371-297-2367,ornare@icloud.com
nisl,Risus Company,sed orci lobortis augue,"P.O. Box 715, 2279 Convallis Av.",(541) 336-8268,magna.malesuada@protonmail.com
risus.,A Odio Incorporated,luctus et ultrices posuere,"587 Ullamcorper, Road",(528) 264-8151,ac@protonmail.ca
nunc,Aliquam Arcu Aliquam Associates,"non, egestas a,",256-8157 Porttitor St.,(432) 501-5716,eu@yahoo.org
dignissim,Mi Lorem Vehicula Foundation,parturient,Ap #785-7072 Euismod Ave,(552) 351-4173,maecenas.mi@outlook.edu
mollis,Magna Cras Convallis LLC,"fringilla, porttitor vulputate, posuere vulputate, lacus. Cras interdum. Nunc","P.O. Box 825, 3775 Morbi Road",(526) 488-3465,eget.lacus.mauris@outlook.couk
vitae,Ut Semper Associates,"lacus, varius et, euismod et, commodo","P.O. Box 325, 1845 Neque Av.",(236) 496-5218,nunc.laoreet.lectus@outlook.edu
Phasellus,Sit Amet LLC,libero. Proin mi. Aliquam gravida mauris,"P.O. Box 150, 4173 Justo St.",1-795-375-5818,neque.non.quam@google.com
tristique,Auctor Corp.,Nam consequat,7334 Lacus Avenue,(517) 885-5812,sollicitudin.adipiscing.ligula@protonmail.org
"a,",Non Corporation,"egestas lacinia. Sed congue,",Ap #405-3179 Augue Road,(947) 397-5741,nibh.phasellus@protonmail.edu
quis,Fringilla Inc.,"Quisque porttitor eros nec tellus. Nunc lectus pede,",679-6240 Suspendisse Road,1-243-812-4975,id.libero.donec@aol.net
nibh.,Metus Eu Erat Limited,"vitae nibh. Donec est mauris,","P.O. Box 214, 9060 Fusce Rd.",(887) 144-8217,tortor.nibh@yahoo.edu
pellentesque,Vivamus Inc.,porttitor interdum. Sed auctor odio a,782-9488 Nec Ave,(577) 530-4823,nullam.scelerisque.neque@yahoo.couk
"cursus,",Nulla Facilisis Suspendisse Corporation,"nonummy ac, feugiat",Ap #461-9530 Etiam Road,(612) 362-5024,leo@outlook.com
eu,Orci In Limited,"vulputate, posuere vulputate, lacus. Cras interdum. Nunc sollicitudin commodo","P.O. Box 639, 5309 In Ave",(345) 811-7856,et@protonmail.edu
Quisque,Ut Tincidunt PC,Curabitur vel lectus. Cum,"P.O. Box 260, 5335 Sem Ave",(872) 439-3437,neque.et.nunc@outlook.ca
Sed,Duis Sit PC,Sed molestie. Sed id risus quis diam,195-1111 Aliquam St.,1-570-336-2143,fermentum.vel.mauris@aol.org
"ornare,",Egestas Fusce Inc.,"mauris id sapien. Cras dolor dolor, tempus",705-4958 Erat. Av.,1-610-124-1978,mollis.nec@google.ca
Proin,Suspendisse Tristique Limited,volutpat. Nulla facilisis. Suspendisse commodo tincidunt nibh. Phasellus,7418 Diam Street,(497) 582-8589,libero.et@protonmail.ca
at,Nam Nulla Industries,nunc interdum feugiat. Sed,"123-2501 Dolor, St.",(801) 350-2007,varius@icloud.couk
luctus,Dui Foundation,tellus. Aenean,Ap #141-1793 Nisi. Ave,(318) 445-4687,et.commodo@aol.couk
natoque,Porta Incorporated,Sed dictum. Proin eget odio. Aliquam vulputate ullamcorper,974-2680 Blandit Av.,(152) 646-6369,sapien.cras.dolor@yahoo.ca
Mauris,Nullam PC,"vel, convallis","P.O. Box 961, 9398 Sem Av.",(862) 772-4748,pede@google.couk
non,Augue Scelerisque Mollis Ltd,Suspendisse ac metus vitae velit,"P.O. Box 166, 1576 Ultricies Road",(942) 772-6338,dolor.donec@hotmail.net
Aliquam,Augue Institute,facilisis. Suspendisse commodo tincidunt nibh. Phasellus,"Ap #232-6938 Vel, Rd.",1-278-506-1058,diam.proin@aol.net
eros.,A Odio Industries,"a, auctor",Ap #506-9446 Etiam St.,1-193-662-7103,sit.amet@icloud.couk
eu,In Magna PC,dignissim magna a tortor. Nunc commodo auctor velit.,Ap #816-5877 Mattis. Road,(637) 466-4111,sit@hotmail.com
eu,Amet Dapibus Industries,"elit, pellentesque a, facilisis",Ap #962-1450 Parturient Road,1-881-617-6224,pellentesque.ultricies@aol.couk
Donec,Vehicula Et Inc.,"dictum placerat, augue. Sed molestie. Sed",8027 Adipiscing Road,1-597-612-2539,interdum.feugiat@google.com
tortor,Sed Dictum Corporation,"magna sed dui. Fusce aliquam, enim",Ap #426-4365 Varius Avenue,(777) 673-9673,ornare.lectus@icloud.com
"a,",Eu Nibh Corp.,facilisi. Sed neque. Sed eget lacus.,Ap #607-1608 Morbi Rd.,1-288-373-1831,taciti.sociosqu.ad@protonmail.couk
"in,",Ut Odio Institute,"ultrices sit amet,",Ap #889-2820 Lectus Road,1-585-438-5288,proin@icloud.ca
mollis,Nec Limited,"tellus,","3618 Quis, Road",(346) 332-1531,morbi@google.edu
"a,",Fermentum Company,"dui, semper et, lacinia vitae, sodales at, velit. Pellentesque","P.O. Box 798, 6010 Duis Avenue",(359) 651-0835,sit.amet.lorem@yahoo.com
egestas,Imperdiet Nec Ltd,Phasellus fermentum convallis ligula. Donec luctus aliquet odio. Etiam,432-3100 Vitae Road,1-201-575-3330,vivamus.rhoncus@outlook.ca
dolor,Sed Nec Metus Corp.,elit. Curabitur sed tortor. Integer aliquam adipiscing lacus.,Ap #514-7324 Neque. Street,(181) 378-3521,eget@protonmail.couk
dapibus,Rhoncus Nullam Foundation,magnis dis parturient,Ap #674-8877 Eget St.,(517) 531-3927,eu@icloud.ca
scelerisque,Eu Neque Pellentesque PC,In condimentum. Donec at arcu. Vestibulum ante ipsum,1515 Enim. Av.,(358) 992-2868,ac.mi@yahoo.org
Cras,Eget Varius Ultrices Company,tristique neque venenatis lacus.,789-2642 Tortor Av.,1-212-562-9804,nunc@hotmail.couk
justo,Malesuada Fames Inc.,"porttitor vulputate, posuere vulputate, lacus. Cras interdum.","P.O. Box 163, 4993 Cursus, Avenue",(552) 136-3111,sapien.cursus@hotmail.couk
aliquam,Nullam Velit Dui Inc.,accumsan neque et nunc.,306-8871 Blandit. Rd.,(408) 936-3343,cursus.et@icloud.org
at,Nunc PC,"Sed nunc est, mollis non, cursus non, egestas",5783 Magna Road,(486) 645-4876,arcu.vestibulum.ante@protonmail.org
iaculis,Duis Corp.,"molestie in, tempus eu, ligula. Aenean euismod mauris eu elit.","P.O. Box 227, 7871 Sed Av.",(367) 586-3348,ac.ipsum.phasellus@yahoo.net
Quisque,Non Leo Company,dui. Suspendisse ac metus vitae velit egestas,539-4780 Eleifend. St.,1-482-466-3510,vel.arcu.curabitur@icloud.net
adipiscing,Id Ante PC,eget nisi,"7988 Vel, Rd.",1-382-313-2714,a@yahoo.ca
"enim,",Cubilia Curae Inc.,et netus et malesuada fames ac turpis egestas. Aliquam,265-3981 Viverra. St.,1-618-691-6704,sed.turpis@outlook.edu
auctor.,Lacus Quisque Associates,dis parturient,907-2670 Nulla Av.,1-842-646-8375,primis.in@yahoo.org
scelerisque,Eget Laoreet Posuere Associates,felis. Nulla tempor augue ac,"5290 Vestibulum, Ave",(434) 726-8925,vestibulum.ante@google.edu
per,Magna Et Limited,"tristique pellentesque, tellus sem mollis dui, in","P.O. Box 199, 7046 Diam Rd.",(431) 306-3330,aliquam.fringilla@aol.org
aliquet,Quis Accumsan Industries,"quam, elementum at, egestas a, scelerisque","P.O. Box 919, 6102 Lectus. Street",1-540-521-3831,sociis.natoque@yahoo.ca
nulla.,Euismod In Company,auctor velit.,"P.O. Box 178, 3212 Mauris. Street",(910) 672-4421,sem.vitae.aliquam@protonmail.net
semper,Ultrices Inc.,mauris erat eget ipsum. Suspendisse sagittis. Nullam vitae,"P.O. Box 727, 3386 Sed Rd.",(136) 262-4568,fermentum@yahoo.couk
arcu.,At Velit Corp.,"egestas a, dui. Cras",Ap #383-8682 Nec St.,1-925-522-2402,nunc.ullamcorper@outlook.edu
arcu,Nisi Corporation,bibendum fermentum metus.,722-8065 Ut St.,1-978-411-8176,sodales.elit@aol.edu
pede.,Quisque Purus LLC,"Nulla tincidunt, neque vitae semper egestas,",864-8995 Egestas Road,1-359-531-1343,sit.amet.dapibus@aol.couk
non,Scelerisque Mollis Corporation,erat eget ipsum. Suspendisse sagittis. Nullam vitae diam. Proin dolor.,Ap #364-6899 Cras Av.,(875) 874-6835,ut@aol.ca
tellus.,Nulla Tempor Limited,Praesent eu,980-2199 Non St.,1-585-402-4724,tincidunt.dui.augue@yahoo.couk
Cum,Consequat Auctor Limited,"pellentesque a, facilisis non, bibendum",8834 Proin Rd.,1-523-746-8556,dictum@aol.com
Integer,Arcu Vestibulum Ut Corp.,"egestas, urna justo faucibus lectus, a sollicitudin orci sem eget",2934 Curabitur Road,(342) 573-2425,mattis.ornare@google.couk
lectus,Rutrum Urna Ltd,risus. Morbi metus.,903-7414 Ante Av.,(311) 683-4342,magna.a.tortor@icloud.couk
Duis,Id Sapien Incorporated,magna.,271-2833 Lacinia Ave,1-609-634-6620,ante.blandit@aol.org
Mauris,Nam Tempor Diam Associates,ac turpis egestas.,675-4707 Arcu Rd.,1-648-433-7721,neque@icloud.net
Cras,Imperdiet LLC,Praesent luctus. Curabitur egestas nunc sed libero. Proin sed,Ap #152-6062 Ornare Rd.,1-313-243-0722,pede.praesent.eu@protonmail.edu
"enim,",Tellus Justo Associates,"imperdiet non, vestibulum nec, euismod in, dolor. Fusce feugiat.",Ap #448-3142 Non Av.,(664) 468-1331,tincidunt.tempus@outlook.ca
ac,Eu Dolor Institute,"orci lobortis augue scelerisque mollis. Phasellus libero mauris, aliquam",7866 Etiam Rd.,(316) 452-4473,sagittis@hotmail.edu
eleifend.,Sodales LLP,"In mi pede, nonummy ut, molestie",269-201 Eu St.,1-815-854-3868,leo.elementum@aol.com
Aliquam,Suspendisse Non LLC,"egestas. Sed pharetra, felis eget varius ultrices, mauris","P.O. Box 320, 4352 Ut Street",1-326-387-3236,lobortis.augue@protonmail.net
netus,In Sodales Corp.,"quis, pede. Suspendisse dui. Fusce",165-2770 Non Av.,1-322-705-7337,et.eros.proin@aol.couk
mauris,Et Rutrum Eu Corporation,metus. Aliquam erat volutpat. Nulla facilisis. Suspendisse commodo tincidunt nibh.,524-1708 Vestibulum St.,1-731-835-7409,purus@google.net
et,Dui Cras Industries,"Nunc lectus pede, ultrices a,",Ap #705-2492 A Ave,(395) 643-8882,consequat.enim@google.ca
nec,Eget Laoreet Incorporated,et nunc. Quisque ornare tortor at,Ap #656-6860 Massa. Avenue,(442) 658-6635,turpis@protonmail.couk
et,Nunc Sed Associates,"in aliquet lobortis,",113-9163 Nibh. Rd.,(455) 375-5589,ut.semper.pretium@hotmail.ca
scelerisque,Orci Tincidunt Limited,"mauris sapien, cursus",Ap #333-9060 Pretium Rd.,(749) 364-4080,fusce.feugiat@google.edu
dis,Nec Inc.,"rhoncus. Donec est. Nunc ullamcorper, velit in","710-1421 Montes, Road",1-843-357-3524,mauris.morbi@yahoo.org
enim.,Est Mollis PC,nunc. In at pede. Cras vulputate velit eu,"Ap #275-8751 Pharetra, Av.",1-828-763-5527,non@yahoo.org
adipiscing,Proin Sed LLP,ut ipsum ac,"1546 Ante, St.",1-601-466-2218,nec.ante.blandit@aol.net
ipsum.,Leo LLP,molestie tellus. Aenean egestas hendrerit neque. In,405-5127 Erat St.,(284) 460-8514,donec@outlook.couk
ligula,Vitae LLP,nonummy. Fusce,"951-6427 In, Avenue",1-151-168-6171,ipsum.cursus.vestibulum@icloud.com
auctor,Duis Cursus Diam Institute,"id, blandit at, nisi. Cum sociis natoque penatibus",5053 Libero. Av.,1-873-785-2316,sem@outlook.edu
vehicula,Donec Associates,neque sed,8512 Accumsan St.,1-283-307-1174,bibendum.donec@hotmail.couk
"at,",At Sem Industries,quis lectus.,Ap #164-693 Sociis Rd.,1-478-371-0401,erat.etiam.vestibulum@icloud.ca
egestas,Fringilla Purus Mauris Institute,"enim. Sed nulla ante, iaculis","P.O. Box 720, 539 Sed Street",(363) 552-8110,id@protonmail.edu
blandit,Donec Tempus Inc.,Integer aliquam adipiscing lacus.,366-638 Varius St.,(323) 361-7285,dis.parturient@google.org
Donec,Quisque Inc.,nibh vulputate mauris sagittis placerat.,226-7936 Donec Street,(278) 582-7203,diam.duis.mi@icloud.org
tempus,Ultrices Posuere Associates,"sit amet, risus. Donec",Ap #844-6971 At Rd.,1-775-170-6915,lacus.etiam@google.org
massa,Donec Vitae Erat PC,non enim commodo hendrerit. Donec porttitor,Ap #888-8668 Dictum Street,1-106-545-5391,ut.dolor@yahoo.net
dictum,Fusce Fermentum Fermentum Corporation,quam vel sapien imperdiet,267-8024 Lacinia Rd.,1-664-554-3191,vivamus.euismod@outlook.com
Donec,Magna Lorem PC,Nulla facilisi. Sed neque. Sed eget lacus. Mauris,Ap #137-4052 Quisque Rd.,(847) 944-9353,in@protonmail.com
"eu,",A Neque Nullam Industries,fringilla. Donec feugiat,Ap #893-6813 Iaculis Road,1-320-543-5346,in@icloud.edu
egestas,Donec Non Corp.,Proin vel,Ap #171-5038 Enim. Av.,1-393-204-3729,vestibulum.lorem@protonmail.com
risus.,Adipiscing Elit LLP,"eu, ligula. Aenean euismod mauris eu elit. Nulla facilisi.","P.O. Box 261, 4485 Vel St.",1-570-429-5663,consectetuer@outlook.org
Proin,Cras Convallis Convallis Company,Sed dictum. Proin,Ap #258-5876 Quis Road,1-518-945-6429,dictum.eu@yahoo.com
ut,Non Dui Corporation,"tempus eu, ligula. Aenean euismod mauris",973-7005 Proin Av.,1-581-236-8777,eu@icloud.org
sed,Luctus Ut Corp.,"enim mi tempor lorem, eget mollis lectus pede et",Ap #748-6276 Egestas. Rd.,1-686-613-1518,mauris.sit@icloud.ca
Nunc,Et Malesuada Inc.,nisi magna,Ap #122-2789 Donec Av.,1-511-455-8241,parturient.montes@outlook.edu
odio,Augue Porttitor Interdum Inc.,Duis,Ap #789-1952 Nisl Avenue,1-161-818-5615,in.sodales@protonmail.org
velit.,Ac Ipsum Phasellus Institute,"diam nunc, ullamcorper eu, euismod ac,",7309 Mauris Av.,(987) 493-8611,eros.nam@icloud.net
non,Penatibus Et LLP,"consequat nec, mollis vitae, posuere at, velit.",Ap #154-1661 Sed Avenue,1-753-833-1717,sociosqu.ad@protonmail.org
